{
  "project": "Blog B974",
  "phase": "strategy",
  "branchName": "test/loop-blog-b974",
  "targetRepo": "/Users/manuelturpin/Desktop/bonsai974/VPS-b974.fr",
  "description": "Phase Strategy pour le Blog B974 AI-Assisted. Définir architecture technique, scope MVP, roadmap et stratégie distribution.",
  "previousPhase": {
    "name": "discovery",
    "status": "complete",
    "stories": ["DISC-001", "DISC-002", "DISC-003", "DISC-004"],
    "outputs": [
      "docs/blog-b974/discovery/01-architecture-audit.md",
      "docs/blog-b974/discovery/02-brand-analysis.md",
      "docs/blog-b974/discovery/03-business-objectives.md",
      "docs/blog-b974/discovery/04-personas-content.md"
    ]
  },
  "userStories": [
    {
      "id": "STRAT-001",
      "title": "Architecture Technique",
      "description": "En tant que développeur, je veux une architecture technique claire, afin de savoir quels composants construire.",
      "acceptanceCriteria": [
        "Stack technique défini (framework, DB, APIs)",
        "Architecture système documentée (diagramme)",
        "Workflow Ralph pour génération contenu spécifié",
        "Intégrations tierces listées (Whisper, Meta, Email)",
        "Décisions techniques justifiées"
      ],
      "priority": 1,
      "passes": true,
      "output": "docs/blog-b974/strategy/01-architecture.md"
    },
    {
      "id": "STRAT-002",
      "title": "Scope MVP",
      "description": "En tant que product owner, je veux un scope MVP clair, afin de livrer rapidement une v1 fonctionnelle.",
      "acceptanceCriteria": [
        "Features must-have vs nice-to-have séparées",
        "MVP défini en 3-5 features core",
        "Critères de succès MVP mesurables",
        "Timeline estimée (semaines)"
      ],
      "priority": 1,
      "passes": true,
      "output": "docs/blog-b974/strategy/02-mvp-scope.md"
    },
    {
      "id": "STRAT-003",
      "title": "Roadmap Produit",
      "description": "En tant que stakeholder, je veux une roadmap claire, afin de planifier les ressources.",
      "acceptanceCriteria": [
        "Roadmap 3-6-12 mois définie",
        "Milestones clés identifiés",
        "Dépendances entre features documentées",
        "Priorités justifiées"
      ],
      "priority": 2,
      "passes": false,
      "output": "docs/blog-b974/strategy/03-roadmap.md"
    },
    {
      "id": "STRAT-004",
      "title": "Stratégie Distribution",
      "description": "En tant que marketeur, je veux une stratégie de distribution claire, afin de maximiser la portée.",
      "acceptanceCriteria": [
        "Canaux de distribution priorisés",
        "Workflow publication → distribution documenté",
        "Outils/APIs sélectionnés (email, social)",
        "Fréquence et timing recommandés"
      ],
      "priority": 2,
      "passes": false,
      "output": "docs/blog-b974/strategy/04-distribution.md"
    }
  ],
  "metadata": {
    "created": "2026-01-11",
    "phaseStarted": "2026-01-11",
    "estimatedStories": 4
  }
}
